
"C:/lscc/radiant/2024.2/tcltk/windows/bin/tclsh" "e155_project_fpga_impl_1_synthesize.tcl"

synthesis -f C:/Users/ekendrick/Documents/GitHub/e155-project/e155_project_fpga/impl_1/e155_project_fpga_impl_1_lattice.synproj -logfile e155_project_fpga_impl_1_lattice.srp
synthesis:  version Radiant Software (64-bit) 2024.2.0.3.0

Copyright (c) 1991-1994 by NeoCAD Inc. All rights reserved.
Copyright (c) 1995 AT&T Corp.   All rights reserved.
Copyright (c) 1995-2001 Lucent Technologies Inc.  All rights reserved.
Copyright (c) 2001 Agere Systems   All rights reserved.
Copyright (c) 2002-2024 Lattice Semiconductor Corporation,  All rights reserved.
Sun Nov 30 15:34:03 2025


Command Line:  C:\lscc\radiant\2024.2\ispfpga\bin\nt64\synthesis.exe -f C:/Users/ekendrick/Documents/GitHub/e155-project/e155_project_fpga/impl_1/e155_project_fpga_impl_1_lattice.synproj -logfile e155_project_fpga_impl_1_lattice.srp -gui -msgset C:/Users/ekendrick/Documents/GitHub/e155-project/e155_project_fpga/promote.xml 

INFO <35002000> - synthesis: Lattice Synthesis Engine launched.

Synthesis options:
The -a option is iCE40UP.
The -t option is SG48.
The -sp option is High-Performance_1.2V.
The -p option is iCE40UP5K.

###################### Device Information ######################
----------------------------------------------------------------
Lattice Family        | iCE40UP
----------------------------------------------------------------
Device                | iCE40UP5K
----------------------------------------------------------------
Package               | SG48
----------------------------------------------------------------
Performance Grade     | High-Performance_1.2V
----------------------------------------------------------------
################################################################

####################### Device Resources #######################
----------------------------------------------------------------
Logic Cells           | 5280
----------------------------------------------------------------
RAM Blocks            | 30
----------------------------------------------------------------
DSP Blocks            | 8
----------------------------------------------------------------
PLLs                  | 1
----------------------------------------------------------------
I/O Pins              | 56
----------------------------------------------------------------
################################################################

Resolving user-selected strategy settings...


###################### Strategy Settings #######################
----------------------------------------------------------------
Optimization Goal     | Area
----------------------------------------------------------------
Top-level Module Name | top
----------------------------------------------------------------
Target Frequency      | 200.000 MHz
----------------------------------------------------------------
Maximum Fanout        | 1000
----------------------------------------------------------------
Timing Path Count     | 3
----------------------------------------------------------------
RAM Read/Write Check  | False
----------------------------------------------------------------
BRAM Utilization      | 100.0%
----------------------------------------------------------------
DSP Usage             | True
----------------------------------------------------------------
DSP Utilization       | 100.0%
----------------------------------------------------------------
FSM Encoding Style    | Auto
----------------------------------------------------------------
Resolve Mixed Drivers | False
----------------------------------------------------------------
Fix Gated Clocks      | True
----------------------------------------------------------------
Mux Style             | Auto
----------------------------------------------------------------
Use Carry Chain       | True
----------------------------------------------------------------
Carry Chain Length    | Infinite
----------------------------------------------------------------
Loop Limit            | 1950
----------------------------------------------------------------
Use I/O Insertion     | True
----------------------------------------------------------------
Use I/O Registers     | True
----------------------------------------------------------------
Resource Sharing      | True
----------------------------------------------------------------
Propagate Constants   | True
----------------------------------------------------------------
Remove Duplicate Reg  | True
----------------------------------------------------------------
Force GSR             | False
----------------------------------------------------------------
ROM Style             | Auto
----------------------------------------------------------------
RAM Style             | Auto
----------------------------------------------------------------
Remove LOC Properties | False
----------------------------------------------------------------
Partition Flow        | False
----------------------------------------------------------------
################################################################


The -comp option is FALSE.
The -syn option is FALSE.

Output HDL filename: e155_project_fpga_impl_1.vm
-path C:/Users/ekendrick/Documents/GitHub/e155-project/e155_project_fpga (searchpath added)
-path C:/Users/ekendrick/Documents/GitHub/e155-project/e155_project_fpga/impl_1 (searchpath added)
-path C:/lscc/radiant/2024.2/ispfpga/ice40tp/data (searchpath added)
Mixed language design
Verilog design file: C:/lscc/radiant/2024.2/ip/pmi/pmi_iCE40UP.v
Verilog design file: C:/Users/ekendrick/Documents/GitHub/e155-project/e155_project_fpga/source/impl_1/top.sv
Verilog design file: C:/Users/ekendrick/Documents/GitHub/e155-project/e155_project_fpga/source/impl_1/led_driver.sv
Verilog design file: C:/Users/ekendrick/Documents/GitHub/e155-project/e155_project_fpga/source/impl_1/counter.sv
Verilog design file: C:/Users/ekendrick/Documents/GitHub/e155-project/e155_project_fpga/source/impl_1/led_string.sv
VHDL library: pmi
VHDL design file: C:/lscc/radiant/2024.2/ip/pmi/pmi_iCE40UP.vhd
WARNING <35935050> - input port TRIM9 is not connected on this instance. VDB-5050
WARNING <35935050> - input port TRIM8 is not connected on this instance. VDB-5050
WARNING <35935050> - input port TRIM7 is not connected on this instance. VDB-5050
WARNING <35935050> - input port TRIM6 is not connected on this instance. VDB-5050
WARNING <35935050> - input port TRIM5 is not connected on this instance. VDB-5050
WARNING <35935050> - input port TRIM4 is not connected on this instance. VDB-5050
WARNING <35935050> - input port TRIM3 is not connected on this instance. VDB-5050
WARNING <35935050> - input port TRIM2 is not connected on this instance. VDB-5050
WARNING <35935050> - input port TRIM1 is not connected on this instance. VDB-5050
WARNING <35935050> - input port TRIM0 is not connected on this instance. VDB-5050
WARNING <35935050> - input port I is not connected on this instance. VDB-5050

Compiling design...

Analyzing Verilog file c:/lscc/radiant/2024.2/ip/pmi/pmi_ice40up.v. VERI-1482
INFO <35901328> - c:/lscc/radiant/2024.2/ip/pmi/pmi_ice40up.v(1): analyzing included file c:/lscc/radiant/2024.2/ip/pmi/pmi_addsub.v. VERI-1328
INFO <35901328> - c:/lscc/radiant/2024.2/ip/pmi/pmi_addsub.v(40): analyzing included file c:/lscc/radiant/2024.2/ip/pmi/../common/adder_subtractor/rtl/lscc_add_sub.v. VERI-1328
INFO <35901328> - c:/lscc/radiant/2024.2/ip/pmi/pmi_ice40up.v(2): analyzing included file c:/lscc/radiant/2024.2/ip/pmi/pmi_add.v. VERI-1328
INFO <35901328> - c:/lscc/radiant/2024.2/ip/pmi/pmi_add.v(50): analyzing included file c:/lscc/radiant/2024.2/ip/pmi/../common/adder/rtl/lscc_adder.v. VERI-1328
INFO <35901328> - c:/lscc/radiant/2024.2/ip/pmi/pmi_ice40up.v(3): analyzing included file c:/lscc/radiant/2024.2/ip/pmi/pmi_complex_mult.v. VERI-1328
INFO <35901328> - c:/lscc/radiant/2024.2/ip/pmi/pmi_complex_mult.v(52): analyzing included file c:/lscc/radiant/2024.2/ip/pmi/../common/complex_mult/rtl/lscc_complex_mult.v. VERI-1328
INFO <35901328> - c:/lscc/radiant/2024.2/ip/pmi/pmi_ice40up.v(4): analyzing included file c:/lscc/radiant/2024.2/ip/pmi/pmi_counter.v. VERI-1328
INFO <35901328> - c:/lscc/radiant/2024.2/ip/pmi/pmi_counter.v(39): analyzing included file c:/lscc/radiant/2024.2/ip/pmi/../common/counter/rtl/lscc_cntr.v. VERI-1328
INFO <35901328> - c:/lscc/radiant/2024.2/ip/pmi/pmi_ice40up.v(5): analyzing included file c:/lscc/radiant/2024.2/ip/pmi/pmi_fifo.v. VERI-1328
INFO <35901328> - c:/lscc/radiant/2024.2/ip/pmi/pmi_fifo.v(44): analyzing included file c:/lscc/radiant/2024.2/ip/pmi/../common/fifo/rtl/lscc_fifo.v. VERI-1328
INFO <35901328> - c:/lscc/radiant/2024.2/ip/pmi/pmi_ice40up.v(6): analyzing included file c:/lscc/radiant/2024.2/ip/pmi/pmi_fifo_dc.v. VERI-1328
INFO <35901328> - c:/lscc/radiant/2024.2/ip/pmi/pmi_fifo_dc.v(47): analyzing included file c:/lscc/radiant/2024.2/ip/pmi/../common/fifo_dc/rtl/lscc_fifo_dc.v. VERI-1328
INFO <35901328> - c:/lscc/radiant/2024.2/ip/pmi/pmi_ice40up.v(7): analyzing included file c:/lscc/radiant/2024.2/ip/pmi/pmi_mac.v. VERI-1328
INFO <35901328> - c:/lscc/radiant/2024.2/ip/pmi/pmi_mac.v(52): analyzing included file c:/lscc/radiant/2024.2/ip/pmi/../common/mult_accumulate/rtl/lscc_mult_accumulate.v. VERI-1328
INFO <35901328> - c:/lscc/radiant/2024.2/ip/pmi/pmi_ice40up.v(8): analyzing included file c:/lscc/radiant/2024.2/ip/pmi/pmi_multaddsubsum.v. VERI-1328
INFO <35901328> - c:/lscc/radiant/2024.2/ip/pmi/pmi_multaddsubsum.v(53): analyzing included file c:/lscc/radiant/2024.2/ip/pmi/../common/mult_add_sub_sum/rtl/lscc_mult_add_sub_sum.v. VERI-1328
INFO <35901328> - c:/lscc/radiant/2024.2/ip/pmi/pmi_ice40up.v(9): analyzing included file c:/lscc/radiant/2024.2/ip/pmi/pmi_multaddsub.v. VERI-1328
INFO <35901328> - c:/lscc/radiant/2024.2/ip/pmi/pmi_multaddsub.v(52): analyzing included file c:/lscc/radiant/2024.2/ip/pmi/../common/mult_add_sub/rtl/lscc_mult_add_sub.v. VERI-1328
INFO <35901328> - c:/lscc/radiant/2024.2/ip/pmi/pmi_ice40up.v(10): analyzing included file c:/lscc/radiant/2024.2/ip/pmi/pmi_mult.v. VERI-1328
INFO <35901328> - c:/lscc/radiant/2024.2/ip/pmi/pmi_mult.v(51): analyzing included file c:/lscc/radiant/2024.2/ip/pmi/../common/multiplier/rtl/lscc_multiplier.v. VERI-1328
INFO <35901328> - c:/lscc/radiant/2024.2/ip/pmi/pmi_ice40up.v(11): analyzing included file c:/lscc/radiant/2024.2/ip/pmi/pmi_ram_dp.v. VERI-1328
INFO <35901328> - c:/lscc/radiant/2024.2/ip/pmi/pmi_ram_dp.v(48): analyzing included file c:/lscc/radiant/2024.2/ip/pmi/../common/ram_dp/rtl/lscc_ram_dp.v. VERI-1328
INFO <35901328> - c:/lscc/radiant/2024.2/ip/pmi/pmi_ice40up.v(12): analyzing included file c:/lscc/radiant/2024.2/ip/pmi/pmi_ram_dq.v. VERI-1328
INFO <35901328> - c:/lscc/radiant/2024.2/ip/pmi/pmi_ram_dq.v(45): analyzing included file c:/lscc/radiant/2024.2/ip/pmi/../common/ram_dq/rtl/lscc_ram_dq.v. VERI-1328
INFO <35901328> - c:/lscc/radiant/2024.2/ip/pmi/pmi_ice40up.v(13): analyzing included file c:/lscc/radiant/2024.2/ip/pmi/pmi_rom.v. VERI-1328
INFO <35901328> - c:/lscc/radiant/2024.2/ip/pmi/pmi_rom.v(45): analyzing included file c:/lscc/radiant/2024.2/ip/pmi/../common/rom/rtl/lscc_rom.v. VERI-1328
INFO <35901328> - c:/lscc/radiant/2024.2/ip/pmi/pmi_ice40up.v(14): analyzing included file c:/lscc/radiant/2024.2/ip/pmi/pmi_sub.v. VERI-1328
INFO <35901328> - c:/lscc/radiant/2024.2/ip/pmi/pmi_sub.v(50): analyzing included file c:/lscc/radiant/2024.2/ip/pmi/../common/subtractor/rtl/lscc_subtractor.v. VERI-1328
INFO <35901328> - c:/lscc/radiant/2024.2/ip/pmi/pmi_ice40up.v(15): analyzing included file c:/lscc/radiant/2024.2/ip/pmi/pmi_ram_dp_be.v. VERI-1328
INFO <35901328> - c:/lscc/radiant/2024.2/ip/pmi/pmi_ram_dp_be.v(49): analyzing included file c:/lscc/radiant/2024.2/ip/pmi/../common/ram_dp/rtl/lscc_ram_dp.v. VERI-1328
INFO <35901328> - c:/lscc/radiant/2024.2/ip/pmi/pmi_ice40up.v(16): analyzing included file c:/lscc/radiant/2024.2/ip/pmi/pmi_ram_dq_be.v. VERI-1328
INFO <35901328> - c:/lscc/radiant/2024.2/ip/pmi/pmi_ram_dq_be.v(45): analyzing included file c:/lscc/radiant/2024.2/ip/pmi/../common/ram_dq/rtl/lscc_ram_dq.v. VERI-1328
INFO <35901328> - c:/lscc/radiant/2024.2/ip/pmi/pmi_ice40up.v(17): analyzing included file c:/lscc/radiant/2024.2/ip/pmi/pmi_dsp.v. VERI-1328
Analyzing Verilog file c:/users/ekendrick/documents/github/e155-project/e155_project_fpga/source/impl_1/top.sv. VERI-1482
Analyzing Verilog file c:/users/ekendrick/documents/github/e155-project/e155_project_fpga/source/impl_1/led_driver.sv. VERI-1482
Analyzing Verilog file c:/users/ekendrick/documents/github/e155-project/e155_project_fpga/source/impl_1/counter.sv. VERI-1482
Analyzing Verilog file c:/users/ekendrick/documents/github/e155-project/e155_project_fpga/source/impl_1/led_string.sv. VERI-1482
Analyzing VHDL file c:/lscc/radiant/2024.2/ip/pmi/pmi_ice40up.vhd. VHDL-1481
Analyzing VHDL file c:/lscc/radiant/2024.2/ip/pmi/pmi_ice40up.vhd

INFO <35921014> - c:/lscc/radiant/2024.2/ip/pmi/pmi_ice40up.vhd(4): analyzing package components. VHDL-1014
INFO <35921504> - The default VHDL library search path is now "C:/Users/ekendrick/Documents/GitHub/e155-project/e155_project_fpga/impl_1". VHDL-1504
Top module language type = Verilog.
Top module name (Verilog, mixed language): top
INFO <35901018> - c:/users/ekendrick/documents/github/e155-project/e155_project_fpga/source/impl_1/top.sv(1): compiling module top. VERI-1018
INFO <35901018> - C:/lscc/radiant/2024.2/ispfpga/../cae_library/synthesis/verilog/iCE40UP.v(756): compiling module HSOSC(CLKHF_DIV=2&apos;b0). VERI-1018
INFO <35901018> - C:/lscc/radiant/2024.2/ispfpga/../cae_library/synthesis/verilog/iCE40UP.v(742): compiling module SP256K. VERI-1018
INFO <35901018> - c:/users/ekendrick/documents/github/e155-project/e155_project_fpga/source/impl_1/led_string.sv(6): compiling module led_string. VERI-1018
INFO <35901018> - c:/users/ekendrick/documents/github/e155-project/e155_project_fpga/source/impl_1/led_driver.sv(6): compiling module led_driver. VERI-1018
INFO <35901018> - c:/users/ekendrick/documents/github/e155-project/e155_project_fpga/source/impl_1/counter.sv(9): compiling module counter. VERI-1018
[Parameter Setting Section Start]

	[Parameter Settings for Instance(s): hf_osc]
	(Module: HSOSC)
		CLKHF_DIV                 2'b00

[Parameter Setting Section End]
INFO <35001774> - Extracted state machine for register '\led_string1/state' with one-hot encoding
State machine has 5 reachable states with original encodings of:

 0000 

 0001 

 0010 

 0011 

 0100 

original encoding -> new encoding (one-hot encoding)

 0000 -> 00001

 0001 -> 00010

 0010 -> 00100

 0011 -> 01000

 0100 -> 10000

INFO <35001774> - Extracted state machine for register '\led_string1/single_led/state' with one-hot encoding
State machine has 9 reachable states with original encodings of:

 00000 

 00001 

 00010 

 00011 

 00100 

 00101 

 00110 

 00111 

 01000 

original encoding -> new encoding (one-hot encoding)

 00000 -> 000000001

 00001 -> 000000010

 00010 -> 000000100

 00011 -> 000001000

 00100 -> 000010000

 00101 -> 000100000

 00110 -> 001000000

 00111 -> 010000000

 01000 -> 100000000




CRITICAL <35001747> - Bit(s) of register driving state[5:0] stuck at '0': 5, 4, 3
CRITICAL <35001747> - Bit(s) of register driving \led_string1/single_led/num_low[23:0] stuck at '0': 23, 22, 21, 20, 19, 18, 17, 16, 15, 14, 13, 12, 11, 10, 9, 8, 7, 6, 1
WARNING <35935040> - Register \led_string1/single_led/num_high_i12 clock is stuck at Zero. VDB-5040
WARNING <35935040> - Register \led_string1/single_led/num_high_i11 clock is stuck at Zero. VDB-5040
WARNING <35935040> - Register \led_string1/single_led/num_high_i6 clock is stuck at Zero. VDB-5040
WARNING <35935040> - Register \led_string1/single_led/num_high_i7 clock is stuck at Zero. VDB-5040
WARNING <35935040> - Register \led_string1/single_led/num_high_i8 clock is stuck at Zero. VDB-5040
WARNING <35935040> - Register \led_string1/single_led/num_high_i9 clock is stuck at Zero. VDB-5040
WARNING <35935040> - Register \led_string1/single_led/num_high_i10 clock is stuck at Zero. VDB-5040
WARNING <35935040> - Register \led_string1/single_led/num_high_i13 clock is stuck at Zero. VDB-5040
WARNING <35935040> - Register \led_string1/single_led/num_high_i14 clock is stuck at Zero. VDB-5040
WARNING <35935040> - Register \led_string1/single_led/num_high_i15 clock is stuck at Zero. VDB-5040
WARNING <35935040> - Register \led_string1/single_led/num_high_i16 clock is stuck at Zero. VDB-5040
WARNING <35935040> - Register \led_string1/single_led/num_high_i17 clock is stuck at Zero. VDB-5040
WARNING <35935040> - Register \led_string1/single_led/num_high_i18 clock is stuck at Zero. VDB-5040
WARNING <35935040> - Register \led_string1/single_led/num_high_i19 clock is stuck at Zero. VDB-5040
WARNING <35935040> - Register \led_string1/single_led/num_high_i20 clock is stuck at Zero. VDB-5040
WARNING <35935040> - Register \led_string1/single_led/num_high_i21 clock is stuck at Zero. VDB-5040
WARNING <35935040> - Register \led_string1/single_led/num_high_i22 clock is stuck at Zero. VDB-5040
WARNING <35935040> - Register \led_string1/single_led/num_high_i23 clock is stuck at Zero. VDB-5040
Duplicate register/latch removal. \led_string1/single_led/num_low__i3 is a one-to-one match with \led_string1/single_led/num_low__i5.

################### Begin Area Report (top)######################
Number of register bits => 162 of 5280 (3 % )
CCU2 => 44
FD1P3XZ => 162
HSOSC => 1
INV => 1
LUT4 => 141
OB => 1
SP256K => 1
################### End Area Report ##################
Number of odd-length carry chains : 0
Number of even-length carry chains : 5

################### Begin Clock Report ######################
Clock Nets
Number of Clocks: 2
  Net : led_string1/single_led/clk_derived_93, loads : 0
  Net : clk, loads : 2
Clock Enable Nets
Number of Clock Enables: 0
Highest fanout non-clock nets
Top 10 highest fanout non-clock nets:
  Net : reset, loads : 59
  Net : led_string1/single_led/n1250, loads : 34
  Net : led_string1/single_led/n590, loads : 31
  Net : led_string1/single_led/n586, loads : 31
  Net : led_string1/single_led/update_bits, loads : 27
  Net : n1144, loads : 24
  Net : n1, loads : 23
  Net : data_in[0], loads : 17
  Net : n2130, loads : 15
  Net : n61[13], loads : 15
################### End Clock Report ##################

################### Begin Constraint Report ######################
Constraint Summary:
  Total number of constraints: 0
  Total number of constraints dropped: 0
###################  End Constraint Report  ######################

Peak Memory Usage: 97 MB

--------------------------------------------------------------
Total CPU Time: 5 secs 
Total REAL Time: 12 secs 
--------------------------------------------------------------
Checksum -- synthesis -- netlist: 68c41a2168aaff858214de7cefb1aa06ac520e4



postsyn -a iCE40UP -p iCE40UP5K -t SG48 -sp High-Performance_1.2V -oc Industrial -top -w -o e155_project_fpga_impl_1_syn.udb e155_project_fpga_impl_1.vm
POSTSYN: Post Synthesis Process Radiant Software (64-bit) 2024.2.0.3.0
Command Line: postsyn -a iCE40UP -p iCE40UP5K -t SG48 -sp High-Performance_1.2V -oc Industrial -top -w -o e155_project_fpga_impl_1_syn.udb -gui -msgset C:/Users/ekendrick/Documents/GitHub/e155-project/e155_project_fpga/promote.xml e155_project_fpga_impl_1.vm 
   Architecture:     iCE40UP
   Device:           iCE40UP5K
   Package:          SG48
   Performance:      High-Performance_1.2V
Reading input file 'e155_project_fpga_impl_1.vm' ...
CPU Time to convert: 0.078125
REAL Time to convert: 0
convert PEAK Memory Usage: 36 MB
convert CURRENT Memory Usage: 36 MB
Removing unused logic ...
Starting design annotation....
 
Constraint Summary:
   Total number of constraints: 1
   Total number of constraints dropped: 0
 
Writing output file 'e155_project_fpga_impl_1_syn.udb'.
POSTSYN finished successfully.
Total CPU Time: 0 secs 
Total REAL Time: 0 secs 
Peak Memory Usage: 44 MB
Checksum -- postsyn: fea08372c356f78ed8fe33b927b8f066a180f4



pnmainc -log pnmain "e155_project_fpga_impl_1_map.tcl"
map:  version Radiant Software (64-bit) 2024.2.0.3.0

Copyright (c) 1991-1994 by NeoCAD Inc. All rights reserved.
Copyright (c) 1995 AT&T Corp.   All rights reserved.
Copyright (c) 1995-2001 Lucent Technologies Inc.  All rights reserved.
Copyright (c) 2001 Agere Systems   All rights reserved.
Copyright (c) 2002-2024 Lattice Semiconductor Corporation,  All rights reserved.

Command line:   map -pdc C:/Users/ekendrick/Documents/GitHub/e155-project/e155_project_fpga/pins.pdc -i e155_project_fpga_impl_1_syn.udb -o e155_project_fpga_impl_1_map.udb -mp e155_project_fpga_impl_1.mrp -hierrpt -gui -msgset C:/Users/ekendrick/Documents/GitHub/e155-project/e155_project_fpga/promote.xml 

Loading device for application GENERIC from file 'itpa08.nph' in environment: C:/lscc/radiant/2024.2/ispfpga.
Package Status:                     Preliminary    Version 1.5.



Design:  top
Family:  iCE40UP
Device:  iCE40UP5K
Package: SG48
Performance Grade:  High-Performance_1.2V

Running general design DRC...




Design Summary:
   Number of slice registers: 162 out of  5280 (3%)
   Number of I/O registers:      0 out of   117 (0%)
   Number of LUT4s:           234 out of  5280 (4%)
      Number of logic LUT4s:             142
      Number of inserted feedthru LUT4s:   3
      Number of replicated LUT4s:          1
      Number of ripple logic:             44 (88 LUT4s)
   Number of IO sites used:   1 out of 39 (3%)
      Number of IO sites used for general PIO: 1
      Number of IO sites used for I3C: 0 out of 2 (0%)
      (note: If I3C is not used, its site can be used as general PIO)
      Number of IO sites used for PIO+I3C: 1 out of 36 (3%)
      Number of IO sites used for OD+RGB IO buffers: 0 out of 3 (0%)
      (note: If RGB LED drivers are not used, sites can be used as OD outputs,
       see TN1288 iCE40 LED Driver Usage Guide)
      Number of IO sites used for PIO+I3C+OD+RGB: 1 out of 39 (3%)
   Number of DSPs:             0 out of 8 (0%)
   Number of I2Cs:             0 out of 2 (0%)
   Number of High Speed OSCs:  1 out of 1 (100%)
   Number of Low Speed OSCs:   0 out of 1 (0%)
   Number of RGB PWM:          0 out of 1 (0%)
   Number of RGB Drivers:      0 out of 1 (0%)
   Number of SCL FILTERs:      0 out of 2 (0%)
   Number of SRAMs:            1 out of 4 (25%)
   Number of WARMBOOTs:        0 out of 1 (0%)
   Number of SPIs:             0 out of 2 (0%)
   Number of EBRs:             0 out of 30 (0%)
   Number of PLLs:             0 out of 1 (0%)
   Number of Clocks:  1
      Net clk: 129 loads, 55 rising, 74 falling (Driver: Pin hf_osc.osc_inst/CLKHF)
   Number of Clock Enables:  9
      Net VCC_net: 5 loads, 0 SLICEs
      Net state[0]: 1 loads, 1 SLICEs
      Net n1419: 4 loads, 4 SLICEs
      Net n1406: 3 loads, 3 SLICEs
      Net n1415: 6 loads, 6 SLICEs
      Net wren: 1 loads, 0 SLICEs
      Net led_string1.single_led.n1138: 3 loads, 3 SLICEs
      Net led_string1.single_led.n1250: 28 loads, 28 SLICEs
      Net led_string1.single_led.n1131: 1 loads, 1 SLICEs
   Number of LSRs:  11
      Net n1: 1 loads, 1 SLICEs
      Net n1672: 1 loads, 1 SLICEs
      Net n1144: 12 loads, 12 SLICEs
      Net reset: 18 loads, 18 SLICEs
      Net n898: 3 loads, 3 SLICEs
      Net nextstate_0__N_104: 1 loads, 1 SLICEs
      Net led_string1.single_led.n229: 4 loads, 4 SLICEs
      Net led_string1.single_led.n590: 13 loads, 13 SLICEs
      Net led_string1.single_led.n1278: 2 loads, 2 SLICEs
      Net led_string1.single_led.n586: 13 loads, 13 SLICEs
      Net led_string1.single_led.n1274: 1 loads, 1 SLICEs
   Top 10 highest fanout non-clock nets:
      Net reset: 53 loads
      Net led_string1.single_led.n1250: 28 loads
      Net led_string1.update_bits: 28 loads
      Net n1: 20 loads
      Net state[0]: 20 loads
      Net state[1]: 18 loads
      Net state[2]: 17 loads
      Net n1144: 15 loads
      Net data_in[0]: 13 loads
      Net led_string1.single_led.n590: 13 loads
Running physical design DRC...

 


   Number of warnings:  0
   Number of criticals: 0
   Number of errors:    0

Constraint Summary:
   Total number of constraints: 2
   Total number of constraints dropped: 0


Total CPU Time: 0 secs  
Total REAL Time: 0 secs  
Peak Memory Usage: 70 MB

Checksum -- map: f7dbf96c5644ceb9a05a57727785395c875017
Thank you for using Radiant. Total CPU/Elapsed time: 0 secs /0 secs 

pnmainc -log pnmain "e155_project_fpga_impl_1_par.tcl"

PAR: Place And Route Radiant Software (64-bit) 2024.2.0.3.0.
PARed on: Sun Nov 30 15:34:33 2025

Command Line: par -w -t 1 -cores 1 -hsp m -exp parPathBased=ON \
	e155_project_fpga_impl_1_map.udb e155_project_fpga_impl_1_par.dir/5_1.udb 

Loading e155_project_fpga_impl_1_map.udb ...
Loading device for application GENERIC from file 'itpa08.nph' in environment: C:/lscc/radiant/2024.2/ispfpga.
Package Status:                     Preliminary    Version 1.5.
Performance Hardware Data Status:   Advanced       Version 1.0.



Design:  top
Family:  iCE40UP
Device:  iCE40UP5K
Package: SG48
Performance Grade:   High-Performance_1.2V

Constraint Summary
   Total number of constraints: 2
   Total number of constraints dropped: 0

Number of Signals: 486
Number of Connections: 1187
Device utilization summary:

   SLICE (est.)     126/2640          5% used
     LUT            234/5280          4% used
     REG            162/5280          3% used
   PIO                1/56            2% used
                      1/36            2% bonded
   IOLOGIC            0/56            0% used
   DSP                0/8             0% used
   I2C                0/2             0% used
   HFOSC              1/1           100% used
   LFOSC              0/1             0% used
   LEDDA_IP           0/1             0% used
   RGBA_DRV           0/1             0% used
   FILTER             0/2             0% used
   SRAM               1/4            25% used
   WARMBOOT           0/1             0% used
   SPI                0/2             0% used
   EBR                0/30            0% used
   PLL                0/1             0% used
   RGBOUTBUF          0/3             0% used
   I3C                0/2             0% used
   OPENDRAIN          0/3             0% used

Pin Constraint Summary:
   1 out of 1 pins locked (100% locked).

Finished Placer Phase 0 (HIER). CPU time: 0 secs , REAL time: 0 secs 


..................
Finished Placer Phase 0 (AP).  CPU time: 0 secs , REAL time: 0 secs 

Starting Placer Phase 1. CPU time: 0 secs , REAL time: 0 secs 
..  ..
....................

Placer score = 97625.

Device SLICE utilization summary after final SLICE packing:
   SLICE            124/2640          4% used

Finished Placer Phase 1. CPU time: 4 secs , REAL time: 5 secs 

Starting Placer Phase 2.
.

Placer score =  74416
Finished Placer Phase 2.  CPU time: 5 secs , REAL time: 5 secs 


------------------ Clock Report ------------------

Global Clocks :
  PRIMARY "clk" from comp "hf_osc.osc_inst" on site "HFOSC_R1C32", clk load = 96, ce load = 0, sr load = 0

  PRIMARY  : 1 out of 8 (12%)

--------------- End of Clock Report ---------------


I/O Usage Summary (final):
   1 out of 56 (1.8%) I/O sites used.
   1 out of 36 (2.8%) bonded I/O sites used.
   Number of I/O components: 1; differential: 0
   Number of Vref pins used: 0

I/O Bank Usage Summary:
+----------+---------------+------------+------------+------------+
| I/O Bank | Usage         | Bank Vccio | Bank Vref1 | Bank Vref2 |
+----------+---------------+------------+------------+------------+
| 0        | 0 / 14 (  0%) | OFF        |            |            |
| 1        | 0 / 14 (  0%) | OFF        |            |            |
| 2        | 1 / 8 ( 12%)  | 3.3V       |            |            |
+----------+---------------+------------+------------+------------+

Total Placer CPU time: 5 secs , REAL time: 5 secs 


Checksum -- place: f9223082ad53d58f97ecd9a08a384d56b5d00369
Writing design to file e155_project_fpga_impl_1_par.dir/5_1.udb ...


Start NBR router at 15:34:38 11/30/25

*****************************************************************
Info: NBR allows conflicts(one node used by more than one signal)
      in the earlier iterations. In each iteration, it tries to  
      solve the conflicts while keeping the critical connections 
      routed as short as possible. The routing process is said to
      be completed when no conflicts exist and all connections   
      are routed.                                                
Note: NBR uses a different method to calculate timing slacks. The
      worst slack and total negative slack may not be the same as
      that in timing report. You should always run the timing    
      tool to verify your design.                                
*****************************************************************

Starting routing resource preassignment
Preassignment Summary:
--------------------------------------------------------------------------------
1 global clock signals routed
341 connections routed (of 1133 total) (30.10%)
---------------------------------------------------------
Clock routing summary:
Primary clocks (1 used out of 8 available):
#4  Signal "clk"
       Clock   loads: 96    out of    96 routed (100.00%)
---------------------------------------------------------
--------------------------------------------------------------------------------
Completed routing resource preassignment
    TimerIf::skewscore 0

Start NBR section for initial routing at 15:34:39 11/30/25
Level 4, iteration 1
+++++++++++++++++++++++++++++++++++++++++++++++++++++++++++++++++++
Routing in Serial Mode ......
+++++++++++++++++++++++++++++++++++++++++++++++++++++++++++++++++++
42(0.02%) conflicts; 0(0.00%) untouched conn; 241578 (nbr) score; 
Estimated worst slack/total negative slack<setup>: -3.533ns/-241.579ns; real time: 0 secs 

Info: Initial congestion level at 75.00% usage is 0
Info: Initial congestion area  at 75.00% usage is 0 (0.00%)

Start NBR section for normal routing at 15:34:39 11/30/25
Level 4, iteration 1
37(0.01%) conflicts; 0(0.00%) untouched conn; 214099 (nbr) score; 
Estimated worst slack/total negative slack<setup>: -3.269ns/-214.100ns; real time: 2 secs 
Level 4, iteration 2
31(0.01%) conflicts; 0(0.00%) untouched conn; 212815 (nbr) score; 
Estimated worst slack/total negative slack<setup>: -3.269ns/-212.816ns; real time: 2 secs 
Level 4, iteration 3
12(0.00%) conflicts; 0(0.00%) untouched conn; 212535 (nbr) score; 
Estimated worst slack/total negative slack<setup>: -3.269ns/-212.536ns; real time: 2 secs 
Level 4, iteration 4
11(0.00%) conflicts; 0(0.00%) untouched conn; 214054 (nbr) score; 
Estimated worst slack/total negative slack<setup>: -3.269ns/-214.055ns; real time: 2 secs 
Level 4, iteration 5
9(0.00%) conflicts; 0(0.00%) untouched conn; 214054 (nbr) score; 
Estimated worst slack/total negative slack<setup>: -3.269ns/-214.055ns; real time: 2 secs 
Level 4, iteration 6
6(0.00%) conflicts; 0(0.00%) untouched conn; 214926 (nbr) score; 
Estimated worst slack/total negative slack<setup>: -3.269ns/-214.927ns; real time: 2 secs 
Level 4, iteration 7
6(0.00%) conflicts; 0(0.00%) untouched conn; 214926 (nbr) score; 
Estimated worst slack/total negative slack<setup>: -3.269ns/-214.927ns; real time: 2 secs 
Level 4, iteration 8
5(0.00%) conflicts; 0(0.00%) untouched conn; 215454 (nbr) score; 
Estimated worst slack/total negative slack<setup>: -3.269ns/-215.455ns; real time: 2 secs 
Level 4, iteration 9
4(0.00%) conflicts; 0(0.00%) untouched conn; 215454 (nbr) score; 
Estimated worst slack/total negative slack<setup>: -3.269ns/-215.455ns; real time: 2 secs 
Level 4, iteration 10
4(0.00%) conflicts; 0(0.00%) untouched conn; 231029 (nbr) score; 
Estimated worst slack/total negative slack<setup>: -3.269ns/-231.030ns; real time: 2 secs 
Level 4, iteration 11
4(0.00%) conflicts; 0(0.00%) untouched conn; 231029 (nbr) score; 
Estimated worst slack/total negative slack<setup>: -3.269ns/-231.030ns; real time: 2 secs 
Level 4, iteration 12
4(0.00%) conflicts; 0(0.00%) untouched conn; 231029 (nbr) score; 
Estimated worst slack/total negative slack<setup>: -3.269ns/-231.030ns; real time: 2 secs 
Level 4, iteration 13
2(0.00%) conflicts; 0(0.00%) untouched conn; 231029 (nbr) score; 
Estimated worst slack/total negative slack<setup>: -3.269ns/-231.030ns; real time: 2 secs 
Level 4, iteration 14
2(0.00%) conflicts; 0(0.00%) untouched conn; 244994 (nbr) score; 
Estimated worst slack/total negative slack<setup>: -3.269ns/-244.995ns; real time: 2 secs 
Level 4, iteration 15
1(0.00%) conflict; 0(0.00%) untouched conn; 244994 (nbr) score; 
Estimated worst slack/total negative slack<setup>: -3.269ns/-244.995ns; real time: 2 secs 
Level 4, iteration 16
1(0.00%) conflict; 0(0.00%) untouched conn; 255165 (nbr) score; 
Estimated worst slack/total negative slack<setup>: -3.533ns/-255.166ns; real time: 2 secs 
Level 4, iteration 17
0(0.00%) conflict; 0(0.00%) untouched conn; 255165 (nbr) score; 
Estimated worst slack/total negative slack<setup>: -3.533ns/-255.166ns; real time: 2 secs 
Level 4, iteration 18
0(0.00%) conflict; 0(0.00%) untouched conn; 256043 (nbr) score; 
Estimated worst slack/total negative slack<setup>: -3.586ns/-256.044ns; real time: 2 secs 

Start NBR section for post-routing at 15:34:40 11/30/25

End NBR router with 0 unrouted connection(s)
Changing speed to m;   changing temperature to -40
Changing speed to 6;   changing temperature to 100

Checksum -- route: d37338c8b1f7c29cd8d40812c2d3742d6f243c

Total CPU time 2 secs 
Total REAL time: 3 secs 
Completely routed.
End of route.  1133 routed (100.00%); 0 unrouted.

Writing design to file e155_project_fpga_impl_1_par.dir/5_1.udb ...


PAR_SUMMARY::Run status = Completed
PAR_SUMMARY::Number of unrouted conns = 0
PAR_SUMMARY::Estimated worst slack<setup/<ns>> = -3.586
PAR_SUMMARY::Timing score<setup/<ns>> = 85.830
PAR_SUMMARY::Estimated worst slack<hold/<ns>> = 1.743
PAR_SUMMARY::Timing score<hold/<ns>> = 0.000
PAR_SUMMARY::Number of errors = 0

Note: user must run 'timing' for timing closure signoff.

Total CPU  Time: 7 secs 
Total REAL Time: 8 secs 
Peak Memory Usage: 132.17 MB


par done!

Copyright (c) 1991-1994 by NeoCAD Inc. All rights reserved.
Copyright (c) 1995 AT&T Corp.   All rights reserved.
Copyright (c) 1995-2001 Lucent Technologies Inc.  All rights reserved.
Copyright (c) 2001 Agere Systems   All rights reserved.
Copyright (c) 2002-2024 Lattice Semiconductor Corporation,  All rights reserved.
Thank you for using Radiant. Total CPU/Elapsed time: 0 secs /8 secs 

timing -sethld -v 10 -u 10 -endpoints 10 -nperend 1 -sp High-Performance_1.2V -hsp m   -pwrprd -html -rpt "e155_project_fpga_impl_1.twr" "e155_project_fpga_impl_1.udb" 
timing -sethld -v 10 -u 10 -endpoints 10 -nperend 1 -sp High-Performance_1.2V -hsp m -pwrprd -html -rpt e155_project_fpga_impl_1.twr e155_project_fpga_impl_1.udb -gui -msgset C:/Users/ekendrick/Documents/GitHub/e155-project/e155_project_fpga/promote.xml
Starting design reading...
Loading device for application GENERIC from file 'itpa08.nph' in environment: C:/lscc/radiant/2024.2/ispfpga.
Package Status:                     Preliminary    Version 1.5.
Performance Hardware Data Status:   Advanced       Version 1.0.
Loading udb::Database ...
Design:  top
Family:  iCE40UP
Device:  iCE40UP5K
Package: SG48
Performance Grade:   High-Performance_1.2V



Successfully loading udb, 0.03 seconds

Initializing timer
Starting design annotation....
High-Performance_1.2V

Starting full timing analysis...
Performance Hardware Data Status:   Advanced       Version 1.0.
Connections ignored  96  counted  1001  covered  997
Changing speed to m;   changing temperature to -40

STA Runtime and Peak Memory Usage :
Total CPU Time: 0 secs 
Total REAL Time: 0 secs 
Peak Memory Usage: 105 MB

 0.795963s wall, 0.718750s user + 0.062500s system = 0.781250s CPU (98.2%)


tmcheck -par "e155_project_fpga_impl_1.par"  

pnmainc -log pnmain "e155_project_fpga_impl_1_bit.tcl"
Loading e155_project_fpga_impl_1.udb ...
Loading device for application GENERIC from file 'itpa08.nph' in environment: C:/lscc/radiant/2024.2/ispfpga.
Package Status:                     Preliminary    Version 1.5.
Performance Hardware Data Status:   Advanced       Version 1.0.



Design:  top
Family:  iCE40UP
Device:  iCE40UP5K
Package: SG48
Performance Grade:   High-Performance_1.2V

Constraint Summary
   Total number of constraints: 2
   Total number of constraints dropped: 0

Successfully loading design udb and device data from disks and to up-layer in CPU time: 0 secs , REAL time: 0 secs 



BITGEN: Bitstream Generator Radiant Software (64-bit) 2024.2.0.3.0
Copyright (c) 1991-1994 by NeoCAD Inc. All rights reserved.
Copyright (c) 1995 AT&T Corp.   All rights reserved.
Copyright (c) 1995-2001 Lucent Technologies Inc.  All rights reserved.
Copyright (c) 2001 Agere Systems   All rights reserved.
Copyright (c) 2002-2024 Lattice Semiconductor Corporation,  All rights reserved.


Running DRC.
DRC detected 0 errors and 0 warnings.

Preference Summary:
+---------------------------------+---------------------------------+
|  Preference                     |  Current Setting                |
+---------------------------------+---------------------------------+
 *  Default setting.
 ** The specified setting matches the default setting.


Creating bit map...
Saving bit stream in "C:/Users/ekendrick/Documents/GitHub/e155-project/e155_project_fpga/impl_1/e155_project_fpga_impl_1.bin".
Bitstream generation complete!

Total CPU Time: 0 secs 
Total REAL Time: 6 secs 
Peak Memory Usage: 121 MB

Thank you for using Radiant. Total CPU/Elapsed time: 0 secs /6 secs 
